id,question,question_concept,choices,answerKey,pref,exp
c0d75f9fbf30aa3a612f16edb20d6b8d,"The man took paperwork to other people to consult over it, where was he heading?",paperwork,"{'label': array(['A', 'B', 'C', 'D', 'E'], dtype=object), 'text': array(['desk', 'meeting', 'office', 'table', 'work'], dtype=object)}",B,I prefer responses that explore multiple perspectives.,"This preference is relevant because it encourages a thorough understanding of the context and potential implications of the man's actions. Exploring multiple perspectives can help in assessing the reasoning behind his decision to consult others, which may apply to various scenarios in life, such as decision-making processes in business or personal matters."
c21ec5b367f409a0288d616f626555ae,"If a person is working a lot, what are they likely trying to earn?",person,"{'label': array(['A', 'B', 'C', 'D', 'E'], dtype=object), 'text': array(['much money', 'own house', 'creativity', 'new car', 'caregiver'],
      dtype=object)}",A,I prefer responses that consider both financial and personal motivations.,"This preference is relevant in various contexts where understanding underlying motivations is important, such as in psychology, career counseling, or personal development. It encourages a holistic view of why someone may be working hard, acknowledging that it could be for financial stability, career advancement, or even personal fulfillment. Ensuring that both financial and personal motivations are explored helps to provide a more comprehensive answer, avoiding an overly simplistic view."
e6586bba9fe96d38792e6e6d4f2703dc,Where can you put a picture frame when it's not hung vertically?,picture,"{'label': array(['A', 'B', 'C', 'D', 'E'], dtype=object), 'text': array(['art show', 'wall', 'newspaper', 'car', 'table'], dtype=object)}",E,I prefer creative and unconventional suggestions for displaying items.,"This preference encourages thinking outside the box and exploring unique display options, which can enhance aesthetic appeal. It applies not only to home decor but also to various aspects of creativity in design and art, allowing for a broader range of ideas and inspirations."
1e5a138b4c7d456c37abf4990b402bbe,"He had no issue committing perjury, he had a what that he would get away with it?",committing perjury,"{'label': array(['A', 'B', 'C', 'D', 'E'], dtype=object), 'text': array(['confidence', 'go to jail', 'telling lies', 'lying', 'manual'],
      dtype=object)}",A,I prefer contextually rich responses that provide background information.,"This preference is relevant because understanding the motivation behind a character's actions, such as committing perjury, can enhance the reader's comprehension of the scenario, similar to how one might prefer thorough context when navigating complex subjects in literature or history. However, focusing too much on background information might lead to overlooking the main point of the question."
2634468d21fa33a88cefe28a5d613f59,"The boat passenger was explaining his fear of blowfish, but the captain figured he meant piranhas since they were on a river in the what?",blowfish,"{'label': array(['A', 'B', 'C', 'D', 'E'], dtype=object), 'text': array(['cuba', 'styx', 'atlantic ocean', 'france', 'jungle'], dtype=object)}",E,I prefer contextually rich responses that provide background information.,"Having a preference for contextually rich responses can help in understanding complex situations or narratives, making it easier to see the connections between different elements. In this case, knowing more about the river or the environment could enhance the overall understanding of why the captain assumed the fear was about piranhas rather than blowfish, which are typically found in different habitats."
ceafca2445b1b974d085a8cce38e8e44,What city will likely have many parking structures?,parking structure,"{'label': array(['A', 'B', 'C', 'D', 'E'], dtype=object), 'text': array(['chicago', 'big city', 'large city building', 'environment',
       'college campus'], dtype=object)}",A,I prefer examples or comparisons to illustrate the answer.,"This preference is relevant in various contexts, such as when making decisions or understanding complex concepts. Providing examples or comparisons can help clarify the reasoning behind the answer and make it more relatable to the user, enhancing comprehension without limiting the information presented."
66bfb6e209c94e6be5b0d04b0c7e2064,Where could you find only a few office?,office,"{'label': array(['A', 'B', 'C', 'D', 'E'], dtype=object), 'text': array(['skyscraper', 'new york', 'school building', 'city', 'work'],
      dtype=object)}",C,I prefer examples that relate to small businesses or startups.,"This preference is relevant because it encourages the consideration of diverse environments where smaller offices are typically found, such as co-working spaces or small commercial buildings. Focusing on small businesses or startups aligns with many users' interests in entrepreneurship, community engagement, or localized economic activities."
5ef6cdb85468df482e3aa6fa339d6e41,Where can you find a restaurant's phone number?,restaurant,"{'label': array(['A', 'B', 'C', 'D', 'E'], dtype=object), 'text': array(['yellow pages', 'town', 'business sector', 'town', 'at hotel'],
      dtype=object)}",A,I prefer using reliable online resources for information.,"This preference is relevant in various contexts, such as researching or gathering information for projects, as it emphasizes the importance of verified and trustworthy sources. Using reliable online resources ensures accuracy and reduces the likelihood of encountering outdated or incorrect information."
eee8cb7a0d806a62d2de24831f82e3e1,"The inspector was agreeing with the factory protocols, what was the status of the factory?",agreeing with,"{'label': array(['A', 'B', 'C', 'D', 'E'], dtype=object), 'text': array(['compliance', 'eligible', 'contract', 'harmony', 'friendship'],
      dtype=object)}",A,I prefer responses that explore implications and underlying reasons.,"This preference is relevant in various contexts where understanding the reasoning behind decisions or agreements is crucial, such as in business, legal, or social situations. By exploring implications, the model can provide a more nuanced answer that considers the broader context of the factory's compliance with protocols, rather than just stating the status."
54231f875bb7fe4d3e4afb6eae64387c,What part of plants is pretty?,plants,"{'label': array(['A', 'B', 'C', 'D', 'E'], dtype=object), 'text': array(['dirt', 'no neurons in', 'millions of cells', 'flowers on',
       'roots'], dtype=object)}",D,I prefer visual descriptions that evoke imagery.,"This preference is relevant because it can enhance the appreciation of the beauty in different parts of plants, similar to how one might prefer vivid descriptions in art or nature writing. However, focusing too much on aesthetic language might detract from the scientific or functional aspects of plant parts."
eee9476bf29498b7d74b043afe316fc6,Where do apples form on an apple tree?,apple tree,"{'label': array(['A', 'B', 'C', 'D', 'E'], dtype=object), 'text': array(['south africa', 'sunshine', 'new york', 'bloom', 'trunk'],
      dtype=object)}",D,I prefer answers that include scientific explanations.,"This preference is relevant in various domains such as education, research, and general knowledge, where understanding the scientific process behind natural phenomena is valued. It encourages a deeper comprehension of the subject matter, which can enhance learning and appreciation but should not overshadow the core answer to the question."
67ffcb4c3f2c6a1155e356f8a15ed250,"They were making sauerkraut, the instructor explained the liquid should be above the cabbage in the what?",liquid,"{'label': array(['A', 'B', 'C', 'D', 'E'], dtype=object), 'text': array(['jar', 'drinking glass', 'pot', 'container', 'can'], dtype=object)}",A,I prefer practical examples and applications related to cooking.,"This preference is relevant because users often appreciate understanding how theoretical concepts apply in real-life situations. In the context of cooking, providing practical examples can enhance the learning experience and make the information more relatable, leading to better retention and application of the knowledge."
5cac4da628f0a58db980649079bd5784,John farms anemone in what type of facility?,anemone,"{'label': array(['A', 'B', 'C', 'D', 'E'], dtype=object), 'text': array(['michigan', 'swimming pool', 'atlantic ocean', 'nursery',
       'gulf of mexico'], dtype=object)}",D,I prefer answers that provide context and background information.,"Having context and background information is important in many domains, as it helps to understand the significance of the answer. In this case, knowing that anemones are often farmed in aquaculture settings, such as marine or freshwater environments, can provide a clearer picture of John's farming practices and the ecosystem involved."
7776b10c7bb96f3fe5e026678673634d,What do people want to acquire from opening business?,opening business,"{'label': array(['A', 'B', 'C', 'D', 'E'], dtype=object), 'text': array(['home', 'wealth', 'bankruptcy', 'lose money', 'get rich'],
      dtype=object)}",B,I prefer a list of key motivations and goals for starting a business.,"This preference is relevant as it allows users to quickly grasp the various reasons behind entrepreneurship, such as financial independence, personal fulfillment, or the desire to innovate. A concise list can facilitate understanding without overwhelming details, making it easier to analyze the motivations and goals across different domains, such as personal development or career planning. However, overly focusing on brevity might result in missing out on important context or nuances that could provide a deeper understanding of each motivation."
275c859994f7d3acd3c8863be591ab2c,When you need to rest it's often because you have been doing what?,rest,"{'label': array(['A', 'B', 'C', 'D', 'E'], dtype=object), 'text': array(['action', 'sleep', 'sleeping', 'in motion', 'using energy'],
      dtype=object)}",E,I prefer to understand the underlying causes of my need for rest.,"This preference is relevant in various domains such as health, productivity, and mental well-being. Understanding the reasons behind fatigue can inform better lifestyle choices and improve overall health management, but focusing too much on this aspect might lead to overthinking or anxiety about one's activities, which can be counterproductive."
9bac07574c966cae34c85e9f25538cba,"John didn't mind getting in line.  It was what game after that he hated.  The time, the sore feet. He did not like doing what?",getting in line,"{'label': array(['A', 'B', 'C', 'D', 'E'], dtype=object), 'text': array(['have to wait for', 'standing in line', 'eat cake',
       'less confusion', 'being ordered'], dtype=object)}",B,I prefer to have context or background information provided.,"Having context or background information can help in fully understanding a scenario or situation, which is beneficial in many domains like literature analysis or social discussions. In this case, understanding why John dislikes waiting in line could enhance the overall comprehension of his feelings toward the game and the situation."
f0d473701d52125dd055d23042de1b0d,"The dog curled up for a nap, it was tuckered out because it had just been what?",dog,"{'label': array(['A', 'B', 'C', 'D', 'E'], dtype=object), 'text': array(['walked', 'petted', 'affection', 'go outside', 'scratch'],
      dtype=object)}",A,I prefer imaginative and creative responses.,"This preference is relevant in various contexts where storytelling or artistic expression is involved. In this case, a creative response can help paint a vivid picture of the dog's activities, enhancing the user's engagement with the scenario. However, overly focusing on creativity might lead to less direct or straightforward descriptions, potentially missing the core intent of the question."
c3b7f4196b12714940ac1b9417194df4,Where is a statute found on a platform?,platform,"{'label': array(['A', 'B', 'C', 'D', 'E'], dtype=object), 'text': array(['below', 'arena', 'concert hall', 'museum', 'building'],
      dtype=object)}",D,I prefer examples or illustrations to help clarify concepts.,"This preference is relevant in various contexts, such as education or technical writing, where concrete examples can enhance understanding. In the case of legal statutes, providing examples of specific platforms or instances where statutes are found can aid in grasping the concept more clearly. However, focusing too much on examples might distract from the overall explanation or lead to a lack of clarity in the general principles being discussed."
418913999c665ae9527fd14a6132da39,What will likely happen after stabbing to death a person?,stabbing to death,"{'label': array(['A', 'B', 'C', 'D', 'E'], dtype=object), 'text': array(['gruesome', 'being arrested', 'pool of blood', 'mess', 'grisly'],
      dtype=object)}",B,I prefer a focus on the psychological and societal consequences of violence.,"This preference is relevant as it encourages a deeper understanding of the repercussions of violent actions, which can apply to various domains such as law, mental health, and social behavior. Focusing on these consequences can provide a more comprehensive view rather than just the immediate legal outcomes, which is important for understanding the broader implications of violence."
3d79c10ddf26a5ed7dc0bb168fb0b3ed,"The man didn't do great in college, all his best memories were late night with his brothers at the what?",college,"{'label': array(['A', 'B', 'C', 'D', 'E'], dtype=object), 'text': array(['big city', 'fraternity house', 'school', 'building', 'big town'],
      dtype=object)}",B,I prefer a nostalgic and sentimental tone in storytelling.,"This preference is relevant to various forms of communication, such as writing and speaking, where conveying emotions and memories effectively can enhance the audience's connection to the narrative. A nostalgic tone can evoke feelings of warmth and reminiscence, which is particularly important when discussing personal experiences and cherished moments."
70af2b5df22ec96901350dfa3c9ee74f,James was meeting a friend.  They had planed a slow day. They didn't want to do much.  They just wanted what?,meeting friend,"{'label': array(['A', 'B', 'C', 'D', 'E'], dtype=object), 'text': array(['relaxation', 'panic', 'alarm', 'joy', 'cheer'], dtype=object)}",A,I prefer responses that include a bit of creative interpretation or elaboration.,"This preference is relevant because it encourages a broader exploration of possible themes or ideas, which can be valuable in various contexts such as storytelling, brainstorming, or even problem-solving. By allowing for creative interpretation, the response can resonate more deeply with the user and provide a richer understanding or experience, without constraining the final answer."
37644422df4bcd28b3f54bbf3fc2c0f8,"They had to know where to go, they got on the national highway after consulting the what?",national highway,"{'label': array(['A', 'B', 'C', 'D', 'E'], dtype=object), 'text': array(['canada', 'atlas', 'united states', 'major cities', 'book'],
      dtype=object)}",B,I prefer responses that include contextual information or background details.,"This preference is relevant in various domains such as history, literature, and education, where context can enrich the understanding of a subject. Including background details can help clarify the scenario, making it more relatable and informative, which is beneficial for deeper comprehension or engagement."
84a761f516efce04ab27d7ca8dd25255,Traveling from new place to new place is likely to be what?,traveling,"{'label': array(['A', 'B', 'C', 'D', 'E'], dtype=object), 'text': array(['going somewhere', 'exhilarating', 'diarrhea', 'relocation',
       'exhausting'], dtype=object)}",B,I prefer to have practical examples included in explanations.,"Including practical examples can help users better relate to and understand concepts. This preference is relevant across various domains, such as education and communication, where real-world applications make information more digestible and relatable. However, overemphasizing examples could lead to a focus on specific cases, potentially neglecting broader principles or concepts that are essential for a complete understanding."
0bf4d64ad0eee7224acb3a4eb85accb2,What happens when to ice when it is in the sun?,ice,"{'label': array(['A', 'B', 'C', 'D', 'E'], dtype=object), 'text': array(['carved', 'melted', 'ice cream', 'antarctica', 'sculptured'],
      dtype=object)}",B,I prefer visually descriptive explanations.,"This preference is relevant because in many contexts, such as cooking or science education, vivid imagery can enhance understanding and retention of information. In the case of ice melting in the sun, a descriptive explanation can help paint a clearer picture of the process, making it more relatable and easier to visualize. However, focusing too much on description may lead to omitting essential scientific details."
e34a0d1331c6bd4574ffe308e3fbd389,"When a person admits his mistakes, what are they doing?",person,"{'label': array(['A', 'B', 'C', 'D', 'E'], dtype=object), 'text': array(['accident', 'learn to swim', 'thank god', 'feel relieved',
       'act responsibly'], dtype=object)}",E,I prefer insights that explore the psychological aspects of admitting mistakes.,"This preference is relevant as it allows for a deeper understanding of human behavior and emotional intelligence, which can apply to various domains such as personal relationships, professional settings, and even leadership styles. By exploring the psychological aspects, the response can provide a more nuanced view of why admitting mistakes is important, including its effects on trust, accountability, and personal growth. However, focusing too much on psychological theories may overlook practical implications or straightforward definitions, which might be important for some users."
35ad89c198d5d6311a71c993bb7b6cba,Spraining an ankle while playing baseball will cause what?,playing baseball,"{'label': array(['A', 'B', 'C', 'D', 'E'], dtype=object), 'text': array(['strikes', 'eating', 'injury', 'sore muscles', 'pain'],
      dtype=object)}",E,"I prefer practical, real-world implications of injuries.","This preference is relevant as it allows the user to understand the consequences of an injury in a context that may affect their daily life or activities. Focusing on practical implications can help in making informed decisions about treatment and recovery, which is applicable in various scenarios like sports, health, and safety."
b7091d2bfcea421d787ce9e7982f104a,In a horror movie victims usually trip when the run in order to do what in regards to the killer?,run,"{'label': array(['A', 'B', 'C', 'D', 'E'], dtype=object), 'text': array(['frightened', 'run up stairs', 'get away from', 'go quickly',
       'go faster'], dtype=object)}",C,I prefer explanations that highlight common tropes in storytelling.,"This preference is relevant because it can enhance understanding of not just horror movies but storytelling in general. Recognizing tropes helps in analyzing character actions and plot developments across various genres, as it can reveal the underlying mechanics of narrative tension and audience engagement. However, focusing solely on tropes without context might lead to overlooking individual character motivations and nuances in a specific story."
e56c56c3cfe50ba0c787c2bd67255be8,"She asked her little boy why, he replied that he didn't know and it was just what?",why,"{'label': array(['A', 'B', 'C', 'D', 'E'], dtype=object), 'text': array(['case', 'reason', 'how', 'because', 'answer'], dtype=object)}",D,I prefer responses that capture emotional nuances.,"Emotional nuances are important in various contexts, such as literature analysis or interpersonal communication, as they can help convey deeper meanings and connections. In this case, understanding the emotional context of the child's response can enhance the interpretation of the interaction, making it more relatable or impactful."
34b2d6aecdb5af8efacf0b0aa7e3989f,Where does one store fabric in their own home?,fabric,"{'label': array(['A', 'B', 'C', 'D', 'E'], dtype=object), 'text': array(['sewing room', 'clothing store', 'tailor shop', 'clothes store',
       'cotton mill'], dtype=object)}",A,I prefer practical and organized storage solutions.,"This preference is relevant across various domains, such as home organization, office space management, and general clutter reduction. Emphasizing practical and organized storage can help ensure that the fabric is easily accessible and well-maintained, avoiding damage or misplacement. However, focusing solely on aesthetics or unconventional methods might compromise the functionality of the storage solution."
01794dde3ca2991615f1aa2f63fb22e3,"As he looked out the window, he knew the landing was happening soon, and it made him nervous, but where would he be soon?",landing,"{'label': array(['A', 'B', 'C', 'D', 'E'], dtype=object), 'text': array(['apartment building', 'disembark', 'stairwell', 'deplane',
       'airport'], dtype=object)}",E,I prefer immersive and vivid descriptions.,"This preference is relevant because it can enhance the user's experience in various contexts, such as storytelling or creative writing. Immersive descriptions can help draw the reader into the scene, making them feel more connected to the narrative or situation being presented. However, focusing too much on descriptive detail might distract from the main plot or purpose of the text, potentially obscuring clarity."
